id,type,content,URL
535,9,Những hướng nào ô tô tải được phép đi?,http://127.0.0.1:8080/C%C3%A2u%20535.jpg
536,9,"Theo hướng mũi tên, thứ tự các xe đi như thế nào là đúng?",http://127.0.0.1:8080/C%C3%A2u%20536.jpg
537,9,Những hướng nào ô tô tải được phép đi?,http://127.0.0.1:8080/C%C3%A2u%20537.jpg
538,9,"Trong hình dưới đây, xe nào chấp hành đúng quy tắc giao thông?",http://127.0.0.1:8080/C%C3%A2u%20538.jpg
539,9,"Theo hướng mũi tên, những hướng nào xe mô tô được phép đi?",http://127.0.0.1:8080/C%C3%A2u%20539.jpg
540,9,"Trong trường hợp này, thứ tự xe đi như thế nào là đúng quy tắc giao thông?",http://127.0.0.1:8080/C%C3%A2u%20540.jpg
541,9,Xe nào phải nhường đường là đúng quy tắc giao thông?,http://127.0.0.1:8080/C%C3%A2u%20541.jpg
542,9,Xe con quay đầu đi ngược lại như hình vẽ dưới có vi phạm quy tặc giao thông không?,http://127.0.0.1:8080/C%C3%A2u%20542.jpg
543,9,"Trong hình dưới, những xe nào vi phạm quy tắc giao thông?",http://127.0.0.1:8080/C%C3%A2u%20543.jpg
544,9,"Đề điều khiển cho xe đi thẳng, người lái xe phải làm gì là đúng quy tắc giao thông?",http://127.0.0.1:8080/C%C3%A2u%20544.jpg
545,9,Người lái xe điều khiển xe chạy theo hướng nào là đúng quy tắc giao thông?,http://127.0.0.1:8080/C%C3%A2u%20545.jpg
546,9,Xe nào phải nhường đường là đúng quy tắc giao thông?,http://127.0.0.1:8080/C%C3%A2u%20546.jpg
547,9,Người lái xe điều khiển xe rẽ trái như thế nào là đúng quy tắc giao thông?,http://127.0.0.1:8080/C%C3%A2u%20547.jpg
548,9,"Trong hình dưới, những xe nào vi phạm quy tắc giao thông?",http://127.0.0.1:8080/C%C3%A2u%20548.jpg
549,9,Xe nào đi trước là đúng quy tắc giao thông?,http://127.0.0.1:8080/C%C3%A2u%20549.jpg
550,9,Người lái xe có thể quay đầu xe như thế nào là đúng quy tắc giao thông?,http://127.0.0.1:8080/C%C3%A2u%20550.jpg
551,9,Thứ tự các xe đi như thế nào là đúng quy tắc giao thông?,http://127.0.0.1:8080/C%C3%A2u%20551.jpg
552,9,"Khi muốn vượt xe tải, người lái xe phải làm gì là đúng quy tắc giao thông?",http://127.0.0.1:8080/C%C3%A2u%20552.jpg
553,9,"Theo tín hiệu đèn, xe nào phải dừng lại là đúng quy tắc giao thông?",http://127.0.0.1:8080/C%C3%A2u%20553.jpg
554,9,Xe nào phải nhường đường là đúng quy tắc giao thông?,http://127.0.0.1:8080/C%C3%A2u%20554.jpg
555,9,Người lái xe có được vượt xe tải để đi thẳng trong trường hợp này không?,http://127.0.0.1:8080/C%C3%A2u%20555.jpg
556,9,Bạn có được phép vượt xe mô tô phía trước không?,http://127.0.0.1:8080/C%C3%A2u%20556.jpg
557,9,Người lái xe dừng tại vị trí nào là đúng quy tắc giao thông?,http://127.0.0.1:8080/C%C3%A2u%20557.jpg
558,9,Bạn được dừng xe ở vị trí nào trong tình huống này?,http://127.0.0.1:8080/C%C3%A2u%20558.jpg
559,9,"Theo tín hiệu đèn của xe cơ giới, xe nào vi phạm quy tắc giao thông?",http://127.0.0.1:8080/C%C3%A2u%20559.jpg
560,9,"Các xe đi theo hướng mũi tên, xe nào vi phạm quy tắc giao thông?",http://127.0.0.1:8080/C%C3%A2u%20560.jpg
561,9,"Các xe đi theo hướng mũi tên, xe nào vi phạm quy tắc giao thông?",http://127.0.0.1:8080/C%C3%A2u%20561.jpg
562,9,"Các xe đi theo hướng mũi tên, xe nào vi phạm quy tắc giao thông?",http://127.0.0.1:8080/C%C3%A2u%20562.jpg
563,9,"Các xe đi theo hướng mũi tên, xe nào vi phạm quy tắc giao thông?",http://127.0.0.1:8080/C%C3%A2u%20563.jpg
564,9,"Trong tình huống dưới đây, để tránh xe phía trước bị hỏng đột xuất trên đường, người lái xe phải làm gì?",http://127.0.0.1:8080/C%C3%A2u%20564.jpg
565,9,"Các xe đi theo hướng mũi tên, xe nào chấp hành đúng quy tắc giao thông?",http://127.0.0.1:8080/C%C3%A2u%20565.jpg
566,9,"Trong hình dưới, những xe nào vi phạm quy tắc giao thông?",http://127.0.0.1:8080/C%C3%A2u%20566.jpg
567,9,Các xe đi theo thứ tự nào là đúng quy tắc giao thông đường bộ?,http://127.0.0.1:8080/C%C3%A2u%20567.jpg
568,9,Các xe đi theo thứ tự nào là đúng quy tắc giao thông đường bộ?,http://127.0.0.1:8080/C%C3%A2u%20568.jpg
569,9,Xe nào phải dừng lại trong trường hợp này?,http://127.0.0.1:8080/C%C3%A2u%20569.jpg
570,9,Xe của bạn được đi theo hướng nào trong trường hợp này?,http://127.0.0.1:8080/C%C3%A2u%20570.jpg
571,9,Xe của bạn được đi theo hướng nào trong trường hợp này?,http://127.0.0.1:8080/C%C3%A2u%20571.jpg
572,9,Bạn xử lý như thế nào trong trường hợp này?,http://127.0.0.1:8080/C%C3%A2u%20572.jpg
573,9,Bạn xử lý như thế nào trong trường hợp này?,http://127.0.0.1:8080/C%C3%A2u%20573.jpg
574,9,Bạn xử lý như thế nào trong trường hợp này?,http://127.0.0.1:8080/C%C3%A2u%20574.jpg
575,9,Xe nào phải nhường đường trong trường hợp này?,http://127.0.0.1:8080/C%C3%A2u%20575.jpg
576,9,Xe nào phải nhường đường trong trường hợp này?,http://127.0.0.1:8080/C%C3%A2u%20576.jpg
577,9,Bạn xử lý như thế nào khi lái xe ô tô vượt qua đoàn người đi xe đạp có tổ chức?,http://127.0.0.1:8080/C%C3%A2u%20577.jpg
578,9,"Phía trước có một xe đang lùi vào nơi đỗ, xe con phía trước đang chuyển sang làn đường bên trái, bạn xử lý như thế nào trong trường hợp này?",http://127.0.0.1:8080/C%C3%A2u%20578.jpg
579,9,Bạn xử lý như thế nào khi xe phía trước đang lùi ra khỏi nơi đô?,http://127.0.0.1:8080/C%C3%A2u%20579.jpg
580,9,"Phía trước có một xe màu xanh đang vượt xe màu vàng trên làn đường của bạn, bạn xử lý như thế nào trong trường hợp này?",http://127.0.0.1:8080/C%C3%A2u%20580.jpg
581,9,"Xe tải phía trước có tín hiệu xin chuyển làn đường, bạn xử lý như thế nào trong trường hợp này?",http://127.0.0.1:8080/C%C3%A2u%20581.jpg
582,9,Bạn xử lý như thế nào trong trường hợp này?,http://127.0.0.1:8080/C%C3%A2u%20582.jpg
583,9,Các xe đi theo thứ tự nào là đúng quy tắc giao thông đường bộ?,http://127.0.0.1:8080/C%C3%A2u%20583.jpg
584,9,Các xe đi theo thứ tự nào là đúng quy tắc giao thông đường bộ?,http://127.0.0.1:8080/C%C3%A2u%20584.jpg
585,9,Xe nào phải nhường đường trong trường hợp này?,http://127.0.0.1:8080/C%C3%A2u%20585.jpg
586,9,Xe nào phải nhường đường trong trường hợp này?,http://127.0.0.1:8080/C%C3%A2u%20586.jpg
587,9,Bạn xử lý như thế nào trong trường hợp này?,http://127.0.0.1:8080/C%C3%A2u%20587.jpg
588,9,Xe nào được đi trước trong trường hợp này?,http://127.0.0.1:8080/C%C3%A2u%20588.jpg
589,9,Các xe đi theo thứ tự nào là đúng quy tắc giao thông đường bộ?,http://127.0.0.1:8080/C%C3%A2u%20589.jpg
590,9,Bạn xử lý như thế nào trong trường hợp này?,http://127.0.0.1:8080/C%C3%A2u%20590.jpg
591,9,Xe nào được đi trước trong trường hợp này?,http://127.0.0.1:8080/C%C3%A2u%20591.jpg
592,9,Xe nào dừng đúng theo quy tắc giao thông?,http://127.0.0.1:8080/C%C3%A2u%20592.jpg
593,9,Các xe đi theo thứ tự nào là đúng quy tắc giao thông đường bộ?,http://127.0.0.1:8080/C%C3%A2u%20593.jpg
594,9,"Để điều khiển xe rẽ trái, bạn chọn hướng đi nào dưới đây?",http://127.0.0.1:8080/C%C3%A2u%20594.jpg
595,9,"Khi gặp xe ngược chiều bật đèn pha trong tình huống dưới đây, bạn xử lý như thế nào?",http://127.0.0.1:8080/C%C3%A2u%20595.jpg
596,9,"Xe của bạn đang di chuyển gần đến khu vực giao cắt với đường sắt, khi rào chăn đang dịch chuyển, bạn điều khiển xe như thế nào là đúng quy tắc giao thông?",http://127.0.0.1:8080/C%C3%A2u%20596.jpg
597,9,"Trong tình huống dưới đây, xe con màu đỏ nhập làn đường cao tốc theo hướng mũi tên là đúng hay sai?",http://127.0.0.1:8080/C%C3%A2u%20597.jpg
598,9,"Trong tình huống dưới đây, xe con màu đỏ có được phép vượt khi xe con màu xanh đang vượt xe tải hay không?",http://127.0.0.1:8080/C%C3%A2u%20598.jpg
599,9,"Trong tình huống dưới đây, xe con màu vàng vượt xe con màu đỏ là đúng quy tắc giao thông hay không?",http://127.0.0.1:8080/C%C3%A2u%20599.jpg
600,9,"Trong tình huống dưới đây, xe đầu kéo kéo rơ moóc (xe container) đang rẽ phải, xe con màu xanh và xe máy phía Sau xe container đi như thê nào đề đảm bảo an toàn?",http://127.0.0.1:8080/C%C3%A2u%20600.jpg
