id,type,content,URL
330,8,Biển nào dưới đây các phương tiện không được phép đi vào?,http://127.0.0.1:8080/C%C3%A2u%20330.jpg
331,8,Gặp biển nào người lái xe không được đỗ xe vào ngày chẵn?,http://127.0.0.1:8080/C%C3%A2u%20331.jpg
332,8,Gặp biển nào người lái xe không được đỗ xe vào ngày lẻ?,http://127.0.0.1:8080/C%C3%A2u%20332.jpg
333,8,Khi gặp biển nào xe ưu tiên theo luật định vẫn phải dừng lại?,http://127.0.0.1:8080/C%C3%A2u%20333.jpg
334,8,"Biển nào cấm tất cả các loại xe cơ giới và thô sơ đi lại trên đường, trừ xe ưu tiên theo luật định (nếu đường vẫn cho xe chạy được)?",http://127.0.0.1:8080/C%C3%A2u%20334.jpg
335,8,Biển nào là biển “Cắm xe chở hàng nguy hiểm”?,http://127.0.0.1:8080/C%C3%A2u%20335.jpg
336,8,Gặp biển nào xe xích lô được phép đi vào?,http://127.0.0.1:8080/C%C3%A2u%20336.jpg
337,8,"Gặp biển nào xe lam, xe xích lô máy được phép đi vào?",http://127.0.0.1:8080/C%C3%A2u%20337.jpg
338,8,Biển báo này có ý nghĩa gì?,http://127.0.0.1:8080/C%C3%A2u%20338.jpg
339,8,Biển báo này có ý nghĩa như thế nào?,http://127.0.0.1:8080/C%C3%A2u%20339.jpg
340,8,Khi gặp các biển này xe ưu tiên theo luật định (có tải trọng hay chiều cao toàn bộ vượt quá chỉ số ghi trên biển) có được phép đi qua hay không?,http://127.0.0.1:8080/C%C3%A2u%20340.jpg
341,8,Biển nào hạn chế chiều cao của xe và hàng?,http://127.0.0.1:8080/C%C3%A2u%20341.jpg
342,8,Biển số 2 có ý nghĩa như thế nào?,http://127.0.0.1:8080/C%C3%A2u%20342.jpg
343,8,Biển số 3 có ý nghĩa như thế nào?,http://127.0.0.1:8080/C%C3%A2u%20343.jpg
344,8,Biển nào cấm máy kéo kéo theo rơ moóc?,http://127.0.0.1:8080/C%C3%A2u%20344.jpg
345,8,"Khi gặp biển số 1, xe ô tô tải có được đi vào không?",http://127.0.0.1:8080/C%C3%A2u%20345.jpg
346,8,Biển nào không có hiệu lực đối với ô tô tải không kéo moóc?,http://127.0.0.1:8080/C%C3%A2u%20346.jpg
347,8,Biển nào cấm máy kéo?,http://127.0.0.1:8080/C%C3%A2u%20347.jpg
348,8,"Khi gặp biển này, xe mô tô ba bánh có được phép rẽ trái hoặc rẽ phải hay không?",http://127.0.0.1:8080/C%C3%A2u%20348.jpg
349,8,"Biển này có hiệu lực đối với xe mô tô hai, ba bánh không?",http://127.0.0.1:8080/C%C3%A2u%20349.jpg
350,8,Biển này có ý nghĩa gì?,http://127.0.0.1:8080/C%C3%A2u%20350.jpg
351,8,Biển phụ đặt dưới biển cấm bóp còi có ý nghĩa gì?,http://127.0.0.1:8080/C%C3%A2u%20351.jpg
352,8,"Chiều dài đoạn đường 500m từ nơi đặt biển này, người lái xe có được phép bấm còi không?",http://127.0.0.1:8080/C%C3%A2u%20352.jpg
353,8,Biển nào xe mô tô hai bánh được đi vào?,http://127.0.0.1:8080/C%C3%A2u%20353.jpg
354,8,Biển nào xe mô tô hai bánh không được đi vào?,http://127.0.0.1:8080/C%C3%A2u%20354.jpg
355,8,Ba biển này có hiệu lực như thế nào?,http://127.0.0.1:8080/C%C3%A2u%20355.jpg
356,8,Biển nào báo hiệu chiều dài đoạn đường phải giữ cự ly tối thiểu giữa hai xe?,http://127.0.0.1:8080/C%C3%A2u%20356.jpg
357,8,Biển nào báo hiệu khoảng cách thực tế từ nơi đặt biển đến nơi cần cự ly tối thiểu giữa hai xe?,http://127.0.0.1:8080/C%C3%A2u%20357.jpg
358,8,Biển này có ý nghĩa gì?,http://127.0.0.1:8080/C%C3%A2u%20358.jpg
359,8,"Theo hướng bên phải có được phép đỗ xe, dừng xe không?",http://127.0.0.1:8080/C%C3%A2u%20359.jpg
360,8,"Gặp biển này, xe ô tô sơ mi rơ moóc có chiều dài toàn bộ kê cả xe, moóc và hàng lớn hơn trị số ghi trên biển có được phép đi vào không?",http://127.0.0.1:8080/C%C3%A2u%20360.jpg
361,8,"Xe ô tô chở hàng vượt quá phía trước và sau thùng xe, mỗi phía quá 10% chiều dài toàn bộ thân xe, tổng chiều dài xe (cả hàng) từ trước đến sau nhỏ hơn trị số ghi trên biển thì có được phép đi vào không?",http://127.0.0.1:8080/C%C3%A2u%20361.jpg
362,8,Biển này có ý nghĩa gì?,http://127.0.0.1:8080/C%C3%A2u%20362.jpg
363,8,Biển này có ý nghĩa gì?,http://127.0.0.1:8080/C%C3%A2u%20363.jpg
364,8,Biển nào là biển “Tốc độ tối đa cho phép về ban đêm”?,http://127.0.0.1:8080/C%C3%A2u%20364.jpg
365,8,"Biển báo nào báo hiệu bắt đầu đoạn đường vào phạm vi khu dân cư, các phương tiện tham gia giao thông phải tuân theo các quy định đi đường được áp dụng ở khu đông dân cư?",http://127.0.0.1:8080/C%C3%A2u%20365.jpg
366,8,Biển nào báo hiệu hạn chế tốc độ của phương tiện không vượt quá trị số ghi trên biển?,http://127.0.0.1:8080/C%C3%A2u%20366.jpg
367,8,Trong các biển báo dưới đây biển nào báo hiệu “Hết đường cao tốc”?,http://127.0.0.1:8080/C%C3%A2u%20367.jpg
368,8,Số 50 ghi trên biển báo dưới đây có ý nghĩa gì?,http://127.0.0.1:8080/C%C3%A2u%20368.jpg
369,8,Trong các biển dưới đây biển nào chỉ dẫn bắt đầu đường cao tốc?,http://127.0.0.1:8080/C%C3%A2u%20369.jpg
370,8,Biển báo dưới đây có ý nghĩa gì?,http://127.0.0.1:8080/C%C3%A2u%20370.jpg
371,8,Gặp biển nào người lái xe phải nhường đường cho người đi bộ?,http://127.0.0.1:8080/C%C3%A2u%20371.jpg
372,8,"Biển nào chỉ đường dành cho người đi bộ, các loại xe không được đi vào khi gặp biển này?",http://127.0.0.1:8080/C%C3%A2u%20372.jpg
373,8,Biển nào báo hiệu “Đường dành cho xe thô sơ”?,http://127.0.0.1:8080/C%C3%A2u%20373.jpg
374,8,Biển nào báo hiệu sắp đến chỗ giao nhau nguy hiểm?,http://127.0.0.1:8080/C%C3%A2u%20374.jpg
375,8,Biển nào báo hiệu “Giao nhau với đường sắt có rào chắn”?,http://127.0.0.1:8080/C%C3%A2u%20375.jpg
376,8,Biển nào báo hiệu “Giao nhau có tín hiệu đèn”?,http://127.0.0.1:8080/C%C3%A2u%20376.jpg
377,8,Biển nào báo hiệu nguy hiểm giao nhau với đường sắt?,http://127.0.0.1:8080/C%C3%A2u%20377.jpg
378,8,Biển nào báo hiệu đường sắt giao nhau với đường bộ không có rào chắn?,http://127.0.0.1:8080/C%C3%A2u%20378.jpg
379,8,Biển nào báo hiệu sắp đến chỗ giao nhau giữa đường bộ và đường sắt?,http://127.0.0.1:8080/C%C3%A2u%20379.jpg
380,8,Biển nào báo hiệu “Cửa chui”?,http://127.0.0.1:8080/C%C3%A2u%20380.jpg
381,8,Hai biển này có ý nghĩa gì?,http://127.0.0.1:8080/C%C3%A2u%20381.jpg
382,8,Biển nào báo hiệu “Nơi đường sắt giao vuông góc với đường bộ”?,http://127.0.0.1:8080/C%C3%A2u%20382.jpg
383,8,Các biển này có ý nghĩa gì?,http://127.0.0.1:8080/C%C3%A2u%20383.jpg
384,8,Biển nào báo hiệu “Hết đoạn đường ưu tiên”?,http://127.0.0.1:8080/C%C3%A2u%20384.jpg
385,8,"Biển nào báo hiệu, chỉ dẫn xe đi trên đường này được quyền ưu tiên qua nơi giao nhau?",http://127.0.0.1:8080/C%C3%A2u%20385.jpg
386,8,Biển nào báo hiệu “Giao nhau với đường không ưu tiên”?,http://127.0.0.1:8080/C%C3%A2u%20386.jpg
387,8,Biển nào báo hiệu “Giao nhau với đường ưu tiên”?,http://127.0.0.1:8080/C%C3%A2u%20387.jpg
388,8,Biển nào báo hiệu “Đường bị thu hẹp”?,http://127.0.0.1:8080/C%C3%A2u%20388.jpg
389,8,"Khi gặp biển nào, người lái xe phải giảm tốc độ, chú ý xe đi ngược chiều, xe đi ở phía đường bị hẹp phải nhường đường cho xe đi ngược chiều?",http://127.0.0.1:8080/C%C3%A2u%20389.jpg
390,8,Biển nào báo hiệu “Giao nhau với đường ưu tiên”?,http://127.0.0.1:8080/C%C3%A2u%20390.jpg
391,8,Biển nào báo hiệu “Đường giao nhau” của các tuyến đường cùng cấp?,http://127.0.0.1:8080/C%C3%A2u%20391.jpg
392,8,Biển nào báo hiệu “Giao nhau với đường không ưu tiên”?,http://127.0.0.1:8080/C%C3%A2u%20392.jpg
393,8,Biển nào báo hiệu “Đường hai chiều”?,http://127.0.0.1:8080/C%C3%A2u%20393.jpg
394,8,"Biển nào báo hiệu phải giảm tốc độ, nhường đường cho xe cơ giới đi ngược chiều qua đường hẹp?",http://127.0.0.1:8080/C%C3%A2u%20394.jpg
395,8,Biển nào chỉ dẫn “Được ưu tiên qua đường hẹp”?,http://127.0.0.1:8080/C%C3%A2u%20395.jpg
396,8,Biển nào báo hiệu “Đường đôi”?,http://127.0.0.1:8080/C%C3%A2u%20396.jpg
397,8,Biển nào báo hiệu “Đường đôi”?,http://127.0.0.1:8080/C%C3%A2u%20397.jpg
398,8,Biển nào báo hiệu “Kết thúc đường đôi”?,http://127.0.0.1:8080/C%C3%A2u%20398.jpg
399,8,Biển nào báo hiệu “Giao nhau với đường hai chiều”?,http://127.0.0.1:8080/C%C3%A2u%20399.jpg
400,8,Biển nào báo hiệu “Đường hai chiều”?,http://127.0.0.1:8080/C%C3%A2u%20400.jpg
401,8,Biển nào báo hiệu “Giao nhau với đường hai chiều”?,http://127.0.0.1:8080/C%C3%A2u%20401.jpg
402,8,Biển nào báo hiệu “Chú ý chướng ngại vật”?,http://127.0.0.1:8080/C%C3%A2u%20402.jpg
403,8,Biển nào chỉ dẫn cho người tham gia giao thông biết vị trí và khoảng cách có làn đường cứu nạn hay làn thoát xe khẩn cấp?,http://127.0.0.1:8080/C%C3%A2u%20403.jpg
404,8,Biển nào báo hiệu “Đường hầm”?,http://127.0.0.1:8080/C%C3%A2u%20404.jpg
405,8,Biển nào dưới đây là biển “Cầu hẹp”?,http://127.0.0.1:8080/C%C3%A2u%20405.jpg
406,8,Biển nào dưới đây là biển “Cầu quay - cầu cất”?,http://127.0.0.1:8080/C%C3%A2u%20406.jpg
407,8,"Biển nào dưới đây là biển “Kè, vực sâu phía trước”?",http://127.0.0.1:8080/C%C3%A2u%20407.jpg
408,8,"Biển nào sau đây là biển “Kè, vực sâu bên đường phía bên trái”?",http://127.0.0.1:8080/C%C3%A2u%20408.jpg
409,8,"Biển nào sau đây là biển “Kè, vực sâu bên đường phía bên phải”?",http://127.0.0.1:8080/C%C3%A2u%20409.jpg
410,8,Biển nào sau đây là biển “Đường trơn”?,http://127.0.0.1:8080/C%C3%A2u%20410.jpg
411,8,Biển nào sau đây là biển “Lề đường nguy hiểm”?,http://127.0.0.1:8080/C%C3%A2u%20411.jpg
412,8,Biển nào sau đây báo trước gần tới đoạn đường đang tiến hành thi công?,http://127.0.0.1:8080/C%C3%A2u%20412.jpg
413,8,Biển nào sau đây cảnh báo nguy hiểm đoạn đường thường xảy ra tai nạn?,http://127.0.0.1:8080/C%C3%A2u%20413.jpg
414,8,Biển nào dưới đây báo hiệu đoạn đường hay xảy ra ùn tắc giao thông?,http://127.0.0.1:8080/C%C3%A2u%20414.jpg
415,8,Gặp biển nào người tham gia giao thông phải đi chậm và thận trọng đề phòng khả năng xuất hiện và di chuyển bất ngờ của trẻ em trên mặt đường?,http://127.0.0.1:8080/C%C3%A2u%20415.jpg
416,8,Biển nào chỉ dẫn nơi bắt đầu đoạn đường dành cho người đi bộ?,http://127.0.0.1:8080/C%C3%A2u%20416.jpg
417,8,Biển nào dưới đây báo hiệu gần đến đoạn đường thường có trẻ em đi ngang qua?,http://127.0.0.1:8080/C%C3%A2u%20417.jpg
418,8,"Gặp biển nào dưới đây người tham gia giao thông cần phải điều chỉnh tốc độ xe chạy cho thích hợp, đề phòng gió ngang thổi mạnh gây lật xe?",http://127.0.0.1:8080/C%C3%A2u%20418.jpg
419,8,Biển nào sau đây là biển “Dốc xuống nguy hiểm”?,http://127.0.0.1:8080/C%C3%A2u%20419.jpg
420,8,Biển nào sau đây là biển “Dốc lên nguy hiểm”?,http://127.0.0.1:8080/C%C3%A2u%20420.jpg
421,8,Biển báo này có ý nghĩa gì?,http://127.0.0.1:8080/C%C3%A2u%20421.jpg
422,8,Biển báo này có ý nghĩa gì?,http://127.0.0.1:8080/C%C3%A2u%20422.jpg
423,8,Biển báo này có ý nghĩa gì?,http://127.0.0.1:8080/C%C3%A2u%20423.jpg
424,8,Biển báo này có ý nghĩa gì?,http://127.0.0.1:8080/C%C3%A2u%20424.jpg
425,8,Biển báo dưới đây có ý nghĩa gì?,http://127.0.0.1:8080/C%C3%A2u%20425.jpg
426,8,Các biển báo này có ý nghĩa gì?,http://127.0.0.1:8080/C%C3%A2u%20426.jpg
427,8,Biển báo này có ý nghĩa gì?,http://127.0.0.1:8080/C%C3%A2u%20427.jpg
428,8,Gặp biển báo này người lái xe phải xử lý thế nào?,http://127.0.0.1:8080/C%C3%A2u%20428.jpg
429,8,Biển báo này có ý nghĩa gì?,http://127.0.0.1:8080/C%C3%A2u%20429.jpg
430,8,Biển nào báo hiệu các phương tiện phải đi đúng làn đường quy định và tuân thủ tốc độ tối đa cho phép?,http://127.0.0.1:8080/C%C3%A2u%20430.jpg
431,8,Biển nào báo hiệu các phương tiện phải tuân thủ tốc độ tối đa cho phép trên từng làn đường?,http://127.0.0.1:8080/C%C3%A2u%20431.jpg
432,8,Biển nào báo hiệu “Đường dành cho xe ô tô”?,http://127.0.0.1:8080/C%C3%A2u%20432.jpg
433,8,Biển nào báo hiệu “Hết đoạn đường dành cho xe ô tô”?,http://127.0.0.1:8080/C%C3%A2u%20433.jpg
434,8,"Khi gặp biển nào thì các phương tiện không được đi vào, trừ ô tô và mô tô?",http://127.0.0.1:8080/C%C3%A2u%20434.jpg
435,8,Biển này có ý nghĩa gì?,http://127.0.0.1:8080/C%C3%A2u%20435.jpg
436,8,"Biển nào (đặt trước ngã ba, ngã tư) cho phép xe được rẽ sang hướng khác?",http://127.0.0.1:8080/C%C3%A2u%20436.jpg
437,8,Biển nào báo hiệu “Hướng đi thẳng phải theo” ?,http://127.0.0.1:8080/C%C3%A2u%20437.jpg
438,8,Biển nào báo hiệu “Đường một chiều”?,http://127.0.0.1:8080/C%C3%A2u%20438.jpg
439,8,Trong các biển dưới đây biển nào là biển “Hết tốc độ tối đa cho phép”?,http://127.0.0.1:8080/C%C3%A2u%20439.jpg
440,8,Hiệu lực của biển “Tốc độ tối đa cho phép” hết tác dụng khi gặp biển nào dưới đây?,http://127.0.0.1:8080/C%C3%A2u%20440.jpg
441,8,Trong các biển dưới đây biển nào là biển “Hết tốc độ tối thiểu” ?,http://127.0.0.1:8080/C%C3%A2u%20441.jpg
442,8,Biển nào dưới đây báo hiệu hết cấm vượt?,http://127.0.0.1:8080/C%C3%A2u%20442.jpg
443,8,Trong các biển dưới đây biển nào là biển “Hết mọi lệnh cấm”?,http://127.0.0.1:8080/C%C3%A2u%20443.jpg
444,8,"Biển nào cho phép được quay đầu xe đi theo hướng ngược lại khi đặt biển trước ngã ba, ngã tư?",http://127.0.0.1:8080/C%C3%A2u%20444.jpg
445,8,Biển nào không cho phép rẽ phải?,http://127.0.0.1:8080/C%C3%A2u%20445.jpg
446,8,"Khi đến chỗ giao nhau, gặp biển nào thì người lái xe không được cho xe đi thẳng, phải rẽ sang hướng khác?",http://127.0.0.1:8080/C%C3%A2u%20446.jpg
447,8,Biển nào cho phép quay đầu xe?,http://127.0.0.1:8080/C%C3%A2u%20447.jpg
448,8,Biển nào chỉ dẫn tên đường trên các tuyến đường đối ngoại?,http://127.0.0.1:8080/C%C3%A2u%20448.jpg
449,8,Biển số 1 có ý nghĩa gì?,http://127.0.0.1:8080/C%C3%A2u%20449.jpg
450,8,Biển số 3 có ý nghĩa gì?,http://127.0.0.1:8080/C%C3%A2u%20450.jpg
451,8,Biển nào báo hiệu “Đường phía trước có làn đường dành cho ô tô khách”?,http://127.0.0.1:8080/C%C3%A2u%20451.jpg
452,8,Biển nào báo hiệu “Rẽ ra đường có làn đường dành cho ô tô khách”?,http://127.0.0.1:8080/C%C3%A2u%20452.jpg
453,8,Biển nào đặt trên đường chính trước khi đến nơi đường giao nhau để rẽ vào đường cụt?,http://127.0.0.1:8080/C%C3%A2u%20453.jpg
454,8,Biển nào chỉ dẫn cho người đi bộ sử dụng cầu vượt qua đường?,http://127.0.0.1:8080/C%C3%A2u%20454.jpg
455,8,Biển nào chỉ dẫn cho người đi bộ sử dụng hầm chui qua đường?,http://127.0.0.1:8080/C%C3%A2u%20455.jpg
456,8,"Biển nào báo hiệu “Nơi đỗ xe dành cho người khuyết tật""?",http://127.0.0.1:8080/C%C3%A2u%20456.jpg
457,8,"Gặp biển báo này, người lái xe phải đỗ xe như thế nào?",http://127.0.0.1:8080/C%C3%A2u%20457.jpg
458,8,"Gặp biển báo này, người tham gia giao thông phải xử lý như thê nào?",http://127.0.0.1:8080/C%C3%A2u%20458.jpg
459,8,"Gặp biển báo dưới đây, người lái xe có bắt buộc phải chạy vòng theo đảo an toàn theo hướng mũi tên khi muốn chuyển hướng hay không?",http://127.0.0.1:8080/C%C3%A2u%20459.jpg
460,8,"Biển nào dưới đây chỉ dẫn địa giới hành chính giữa các thành phố, tỉnh, huyện?",http://127.0.0.1:8080/C%C3%A2u%20460.jpg
461,8,Biển nào báo hiệu “Cầu vượt liên thông”?,http://127.0.0.1:8080/C%C3%A2u%20461.jpg
462,8,Biển số 1 có ý nghĩa gì?,http://127.0.0.1:8080/C%C3%A2u%20462.jpg
463,8,Biển nào báo hiệu “Tuyến đường cầu vượt cắt qua”?,http://127.0.0.1:8080/C%C3%A2u%20463.jpg
464,8,Biển báo dưới đây có ý nghĩa gì?,http://127.0.0.1:8080/C%C3%A2u%20464.jpg
465,8,"Tại đoạn đường có biển “Làn đường dành riêng cho từng loại xe” dưới đây, các phương tiện có được phép chuyển sang làn khác để đi theo hành trình mong muốn khi đến gần nơi đường bộ giao nhau hay không?",http://127.0.0.1:8080/C%C3%A2u%20465.jpg
466,8,"Tại đoạn đường có cắm biển dưới đây, xe tải và xe khách có được phép đi vào không?",http://127.0.0.1:8080/C%C3%A2u%20466.jpg
467,8,"Tại đoạn đường có cắm biển dưới đây, xe tải và xe khách có được phép đi vào không?",http://127.0.0.1:8080/C%C3%A2u%20467.jpg
468,8,Biển nào báo hiệu kết thúc đường cao tốc?,http://127.0.0.1:8080/C%C3%A2u%20468.jpg
469,8,Biển này có ý nghĩa gì?,http://127.0.0.1:8080/C%C3%A2u%20469.jpg
470,8,Biển này có ý nghĩa gì?,http://127.0.0.1:8080/C%C3%A2u%20470.jpg
471,8,Ý nghĩa các biểu tượng ghi trên biển chỉ dẫn là gì?,http://127.0.0.1:8080/C%C3%A2u%20471.jpg
472,8,Biển này có ý nghĩa gì?,http://127.0.0.1:8080/C%C3%A2u%20472.jpg
473,8,"Trên đường cao tốc, gặp biển nào thì người lái xe đi theo hướng bên trái để tránh chướng ngại vật?",http://127.0.0.1:8080/C%C3%A2u%20473.jpg
474,8,"Trên đường cao tốc, gặp biển nào thì người lái xe đi theo hướng bên phải đê tránh chướng ngại vật?",http://127.0.0.1:8080/C%C3%A2u%20474.jpg
475,8,"Trên đường cao tốc, gặp biển nào thì người lái xe đi được cả hai hướng (bên trái hoặc bên phải) đê tránh chướng ngại vật?",http://127.0.0.1:8080/C%C3%A2u%20475.jpg
476,8,"Trên đường cao tốc, gặp biển nào người lái xe phải chú ý đổi hướng đi khi sắp vào đường cong nguy hiểm?",http://127.0.0.1:8080/C%C3%A2u%20476.jpg
477,8,Vạch mũi tên chỉ hướng trên mặt đường nào dưới đây cho phép xe chỉ được đi thẳng và rẽ phải?,http://127.0.0.1:8080/C%C3%A2u%20477.jpg
478,8,Vạch kẻ đường nào dưới đây là vạch phân chia các làn xe cùng chiều?,http://127.0.0.1:8080/C%C3%A2u%20478.jpg
479,8,"Vạch kẻ đường nào dưới đây là vạch phân chia hai chiều xe chạy (vạch tim đường), xe không được lấn làn, không được đè lên vạch?",http://127.0.0.1:8080/C%C3%A2u%20479.jpg
480,8,Vạch kẻ đường nào dưới đây là vạch phân chia hai chiều xe chạy (vạch tim đường)?,http://127.0.0.1:8080/C%C3%A2u%20480.jpg
481,8,Các vạch dưới đây có tác dụng gì?,http://127.0.0.1:8080/C%C3%A2u%20481.jpg
482,8,Các vạch dưới đây có tác dụng gì?,http://127.0.0.1:8080/C%C3%A2u%20482.jpg
483,8,Khi gặp vạch kẻ đường nào các xe được phép đè vạch?,http://127.0.0.1:8080/C%C3%A2u%20483.jpg
484,8,Vạch dưới đây có tác dụng gì?,http://127.0.0.1:8080/C%C3%A2u%20484.jpg
485,8,Vạch dưới đây có ý nghĩa gì?,http://127.0.0.1:8080/C%C3%A2u%20485.jpg
486,8,Vạch dưới đây có ý nghĩa gì?,http://127.0.0.1:8080/C%C3%A2u%20486.jpg
487,9,Thứ tự các xe đi như thế nào là đúng quy tắc giao thông?,http://127.0.0.1:8080/C%C3%A2u%20487.jpg
488,9,Thứ tự các xe đi như thế nào là đúng quy tắc giao thông?,http://127.0.0.1:8080/C%C3%A2u%20488.jpg
489,9,"Theo hướng mũi tên, thứ tự các xe đi như thế nào là đúng quy tắc giao thông?",http://127.0.0.1:8080/C%C3%A2u%20489.jpg
490,9,Thứ tự các xe đi như thế nào là đúng quy tắc giao thông?,http://127.0.0.1:8080/C%C3%A2u%20490.jpg
491,9,Xe nào phải nhường đường trong trường hợp này?,http://127.0.0.1:8080/C%C3%A2u%20491.jpg
492,9,Trường hợp này xe nào được quyền đi trước?,http://127.0.0.1:8080/C%C3%A2u%20492.jpg
493,9,Thứ tự các xe đi như thế nào là đúng quy tắc giao thông?,http://127.0.0.1:8080/C%C3%A2u%20493.jpg
494,9,Thứ tự các xe đi như thế nào là đúng quy tắc giao thông?,http://127.0.0.1:8080/C%C3%A2u%20494.jpg
495,9,Xe nào được quyền đi trước trong trường hợp này?,http://127.0.0.1:8080/C%C3%A2u%20495.jpg
496,9,Xe nào phải nhường đường đi cuối cùng qua nơi giao nhau này?,http://127.0.0.1:8080/C%C3%A2u%20496.jpg
497,9,Xe nào phải nhường đường là đúng quy tắc giao thông?,http://127.0.0.1:8080/C%C3%A2u%20497.jpg
498,9,Xe nào được quyền đi trước trong trường hợp này?,http://127.0.0.1:8080/C%C3%A2u%20498.jpg
499,9,"Theo tín hiệu đèn, xe nào được phép đi?",http://127.0.0.1:8080/C%C3%A2u%20499.jpg
500,9,"Theo tín hiệu đèn, xe nào được quyền đi là đúng quy tắc giao thông?",http://127.0.0.1:8080/C%C3%A2u%20500.jpg
501,9,Trong trường hợp này xe nào được quyền đi trước?,http://127.0.0.1:8080/C%C3%A2u%20501.jpg
502,9,"Theo tín hiệu đèn, xe tải đi theo hướng nào là đúng quy tắc giao thông?",http://127.0.0.1:8080/C%C3%A2u%20502.jpg
503,9,"Các xe đi theo hướng mũi tên, xe nào vi phạm quy tắc giao thông?",http://127.0.0.1:8080/C%C3%A2u%20503.jpg
504,9,Thứ tự các xe đi như thế nào là đúng quy tắc giao thông?,http://127.0.0.1:8080/C%C3%A2u%20504.jpg
505,9,Trong trường hợp này xe nào đỗ vi phạm quy tắc giao thông?,http://127.0.0.1:8080/C%C3%A2u%20505.jpg
506,9,Xe nào được quyền đi trước?,http://127.0.0.1:8080/C%C3%A2u%20506.jpg
507,9,"Theo hướng mũi tên, những hướng nào xe gắn máy đi được?",http://127.0.0.1:8080/C%C3%A2u%20507.jpg
508,9,Xe nào đỗ vi phạm quy tắc giao thông?,http://127.0.0.1:8080/C%C3%A2u%20508.jpg
509,9,Xe nào đỗ vi phạm quy tắc giao thông?,http://127.0.0.1:8080/C%C3%A2u%20509.jpg
510,9,Xe tải kéo mô tô ba bánh như hình này có đúng quy tắc giao thông không?,http://127.0.0.1:8080/C%C3%A2u%20510.jpg
511,9,"Theo hướng mũi tên, hướng nào xe không được phép đi?",http://127.0.0.1:8080/C%C3%A2u%20511.jpg
512,9,"Theo hướng mũi tên, những hướng nào ô tô không được phép đi?",http://127.0.0.1:8080/C%C3%A2u%20512.jpg
513,9,Xe nào vượt đúng quy tắc giao thông?,http://127.0.0.1:8080/C%C3%A2u%20513.jpg
514,9,"Theo hướng mũi tên, gặp biển hướng đi phải theo đặt trước ngã tư, những hướng nào xe được phép đi?",http://127.0.0.1:8080/C%C3%A2u%20514.jpg
515,9,Xe kéo nhau như hình này có vi phạm quy tắc giao thông không?,http://127.0.0.1:8080/C%C3%A2u%20515.jpg
516,9,Xe nào phải nhường đường trong trường hợp này?,http://127.0.0.1:8080/C%C3%A2u%20516.jpg
517,9,Xe nào được quyền đi trước trong trường hợp này?,http://127.0.0.1:8080/C%C3%A2u%20517.jpg
518,9,Xe kéo nhau trong trường hợp này đúng quy định không?,http://127.0.0.1:8080/C%C3%A2u%20518.jpg
519,9,"Theo hướng mũi tên, những hướng nào ô tô con được phép đi?",http://127.0.0.1:8080/C%C3%A2u%20519.jpg
520,9,Thứ tự các xe đi như thế nào là đúng quy tắc giao thông?,http://127.0.0.1:8080/C%C3%A2u%20520.jpg
521,9,"Theo hướng mũi tên, những hướng nào xe tải được phép đi?",http://127.0.0.1:8080/C%C3%A2u%20521.jpg
522,9,Những hướng nào xe tải được phép đi?,http://127.0.0.1:8080/C%C3%A2u%20522.jpg
523,9,Những hướng nào ô tô tải được phép đi?,http://127.0.0.1:8080/C%C3%A2u%20523.jpg
524,9,Những hướng nào ô tô tải được phép đi?,http://127.0.0.1:8080/C%C3%A2u%20524.jpg
525,9,Xe nào được quyền đi trước trong trường hợp này?,http://127.0.0.1:8080/C%C3%A2u%20525.jpg
526,9,Ô tô con đi theo chiều mũi tên có vi phạm quy tắc giao thông không?,http://127.0.0.1:8080/C%C3%A2u%20526.jpg
527,9,Xe nào vi phạm quy tắc giao thông?,http://127.0.0.1:8080/C%C3%A2u%20527.jpg
528,9,Các xe đi như thế nào là đúng quy tắc giao thông?,http://127.0.0.1:8080/C%C3%A2u%20528.jpg
529,9,"Theo hướng mũi tên, xe nào được phép đi?",http://127.0.0.1:8080/C%C3%A2u%20529.jpg
530,9,Xe con vượt xe tải như trường hợp này có đúng không?,http://127.0.0.1:8080/C%C3%A2u%20530.jpg
531,9,Xe nào vượt đúng quy tắc giao thông?,http://127.0.0.1:8080/C%C3%A2u%20531.jpg
532,9,"Đi theo hướng mũi tên, xe nào vi phạm quy tắc giao thông?",http://127.0.0.1:8080/C%C3%A2u%20532.jpg
533,9,Thứ tự các xe đi như thế nào là đúng quy tắc giao thông?,http://127.0.0.1:8080/C%C3%A2u%20533.jpg
534,9,Thứ tự các xe đi như thế nào là đúng quy tắc giao thông?,http://127.0.0.1:8080/C%C3%A2u%20534.jpg
