id,type,content,URL
171,5,"Các xe đi theo hướng mũi tên, xe nào vi phạm quy tắc giao thông?",D:/New folder/data_img_moto/Câu 171.jpg
172,5,Thứ tự các xe đi như thế nào là đúng quy tắc giao thông?,D:/New folder/data_img_moto/Câu 172.jpg
173,5,Trong trường hợp này xe nào đỗ vi phạm quy tắc giao thông?,D:/New folder/data_img_moto/Câu 173.jpg
174,5,"Theo hướng mũi tên, những hướng nào xe gắn máy đi được?",D:/New folder/data_img_moto/Câu 174.jpg
175,5,Xe nào đỗ vi phạm quy tắc giao thông?,D:/New folder/data_img_moto/Câu 175.jpg
176,5,Xe nào đỗ vi phạm quy tắc giao thông?,D:/New folder/data_img_moto/Câu 176.jpg
177,5,Xe tải kéo mô tô ba bánh như hình này có đúng quy tắc giao thông không?,D:/New folder/data_img_moto/Câu 177.jpg
178,5,Xe nào được quyền đi trước trong trường hợp này?,D:/New folder/data_img_moto/Câu 178.jpg
179,5,Thứ tự các xe đi như thế nào là đúng quy tắc giao thông?,D:/New folder/data_img_moto/Câu 179.jpg
180,5,Xe nào được quyền đi trước trong trường hợp này?,D:/New folder/data_img_moto/Câu 180.jpg
181,5,Xe nào vi phạm quy tắc giao thông?,D:/New folder/data_img_moto/Câu 181.jpg
182,5,Các xe đi như thế nào là đúng quy tắc giao thông?,D:/New folder/data_img_moto/Câu 182.jpg
183,5,"Theo hướng mũi tên, xe nào được phép đi?",D:/New folder/data_img_moto/Câu 183.jpg
184,5,"Trong hình dưới đây, xe nào chấp hành đúng quy tắc giao thông?",D:/New folder/data_img_moto/Câu 184.jpg
185,5,"Theo hướng mũi tên, những hướng nào xe mô tô được phép đi?",D:/New folder/data_img_moto/Câu 185.jpg
186,5,"Trong trường hợp này, thứ tự xe đi như thế nào là đúng quy tắc giao thông?",D:/New folder/data_img_moto/Câu 186.jpg
187,5,"Trong hình dưới, những xe nào vi phạm quy tắc giao thông?",D:/New folder/data_img_moto/Câu 187.jpg
188,5,"Trong hình dưới, những xe nào vi phạm quy tắc giao thông?",D:/New folder/data_img_moto/Câu 188.jpg
189,5,Bạn có được phép vượt xe mô tô phía trước không?,D:/New folder/data_img_moto/Câu 189.jpg
190,5,"Theo tín hiệu đèn của xe cơ giới, xe nào vi phạm quy tắc giao thông?",D:/New folder/data_img_moto/Câu 190.jpg
191,5,"Các xe đi theo hướng mũi tên, xe nào vi phạm quy tắc giao thông?",D:/New folder/data_img_moto/Câu 191.jpg
192,5,"Các xe đi theo hướng mũi tên, xe nào vi phạm quy tắc giao thông?",D:/New folder/data_img_moto/Câu 192.jpg
193,5,"Các xe đi theo hướng mũi tên, xe nào vi phạm quy tắc giao thông?",D:/New folder/data_img_moto/Câu 193.jpg
194,5,"Các xe đi theo hướng mũi tên, xe nào chấp hành đúng quy tắc giao thông?",D:/New folder/data_img_moto/Câu 194.jpg
195,5,Các xe đi theo thứ tự nào là đúng quy tắc giao thông đường bộ?,D:/New folder/data_img_moto/Câu 195.jpg
196,5,Các xe đi theo thứ tự nào là đúng quy tắc giao thông đường bộ?,D:/New folder/data_img_moto/Câu 196.jpg
197,5,Bạn xử lý như thế nào trong trường hợp này?,D:/New folder/data_img_moto/Câu 197.jpg
198,5,Xe nào dừng đúng theo quy tắc giao thông?,D:/New folder/data_img_moto/Câu 198.jpg
199,5,"Xe của bạn đang di chuyển gần đến khu vực giao cắt với đường sắt, khi rào chắn đang dịch chuyển, bạn điều khiển xe như thế nào là đúng quy tắc giao thông?",D:/New folder/data_img_moto/Câu 199.jpg
200,5,"Trong tình huống dưới đây, xe đầu kéo kéo rơ moóc (xe container) đang rẽ phải, xe con màu Xanh và xe máy phía Sau xe contain đi như thế nào để đảm bảo an toàn?",D:/New folder/data_img_moto/Câu 200.jpg
