id,type,content,URL
152,0, Người lái xe phải xử lý như thế nào khi quan sát phía trước thấy người đi bộ đang sang đường tại nơi có vạch đường dành cho người đi bộ để đảm bảo an toàn?,
153,0," Khi muốn lùi xe nhưng không quan sát được phía sau, cần làm gì để đảm bảo an toàn?",
154,3,Người điều khiển phương tiện tham gia giao thông đường bộ phải giảm tốc độ để có thể dừng lại một cách an toàn trong các trường hợp nào dưới đây?,
155,3,"Tại những đoạn đường không bố trí biển báo hạn chế tốc độ, không bố trí biển báo khoảng cách an toàn tối thiểu giữa hai xe, người điều khiển phương tiện tham gia giao thông phải thực hiện quy định nào dưới đây để đảm bảo an toàn giao thông?",
156,3,"Khi tham gia giao thông trên đường cao tốc, người lái xe, người điều khiển xe máy chuyên dùng phải thực hiện như thế nào là đúng quy tắc giao thông?",
157,3,"Theo Luật Giao thông đường bộ, tín hiệu đèn giao thông gồm 3 màu nào dưới đây?",
158,3,"Tại nơi đường giao nhau, khi đèn điều khiển giao thông có tín hiệu màu vàng, người điều khiển giao thông phải chấp hành như thế nào là đúng quy tắc giao thông?",
159,3,"Để báo hiệu cho xe phía trước biết xe mô tô của bạn muôn vượt, bạn phải có tín hiệu như thế nào dưới đây?",
160,0," Khi tham gia giao thông trên đường cao tốc, người điều khiển phương tiện cơ giới có được dừng, đỗ xe trên phần đường xe chạy hay không?",
161,3,"Khi xe gặp sự cố kỹ thuật trên đường cao tốc, bạn phải xử lý theo thứ tự như thế nào dưới đây để đảm bảo an toàn giao thông?",
162,3,"Khi người lái xe ô tô dừng, đỗ sát theo lề đường, hè phố phía bên phải theo chiều đi của mình, bánh xe gần nhất không được cách xa lề đường, hè phố quá bao nhiêu mét trong các trường hợp dưới đây và không gây cản trở, nguy hiểm cho giao thông?",
163,3,"Khi dừng, đỗ xe trên đường phố hẹp, người lái xe ô tô phải dừng, đỗ xe ở vị trí cách xe ô tô đang đỗ bên kia đường khoảng cách tối thiểu là bao nhiêu mét trong các trường hợp dưới đây để đảm bảo an toàn giao thông?",
164,3,"Trên đường bộ, người lái xe ô tô có được phép dừng xe, đỗ xe song song với một xe khác đang dừng, đồ hay không?",
165,3,Người điều khiển xe mô tô phải giảm tốc độ và hết sức thận trọng khi qua những đoạn đường nào dưới đây?,
166,3,"Khi gặp xe buýt đang dừng đón, trả khách, người điều khiển xe mô tô phải xử lý như thế nào dưới đây để đảm bảo an toàn giao thông?",
167,4,"Người lái xe khách, xe buýt cần thực hiện những nhiệm vụ gì dưới đây?",
168,4,"Trong hoạt động vận tải đường bộ, các hành vi nào dưới đây bị nghiêm cấm?",
169,4,"Trong hoạt động vận tải khách, những hành vi nào dưới đây bị nghiêm cấm?",
170,4,Thời gian làm việc của người lái xe ô tô không được lái xe liên tục quá bao nhiêu giờ trong trường hợp dưới đây?,
171,4,Thời gian làm việc trong một ngày của người lái xe ô tô không được vượt quá bao nhiêu giờ trong trường hợp dưới đây?,
172,4,Người lái xe khách phải chấp hành những quy định nào dưới đây?,
173,4,Lái xe kinh doanh vận tải khách phải có trách nhiệm gì sau đây?,
174,4,Người kinh doanh vận tải hành khách có những quyền hạn nào dưới đây?,
175,4,Hành khách có các quyền gì khi đi trên xe ô tô vận tải khách theo tuyến cố định?,
176,4,Hành khách có các nghĩa vụ gì khi đi trên xe ô tô vận tải hành khách?,
177,4,Người kinh doanh vận tải hàng hóa có các quyền gì ở dưới đây?,
178,4,Người kinh doanh vận tải hàng hóa có các nghĩa vụ gì dưới đây?,
179,4,Người thuê vận tải hàng hóa có các quyền hạn gì dưới đây?,
180,4,Người thuê vận tải hàng hóa có các nghĩa vụ gì dưới đây?,
181,4,Người nhận hàng có các quyền gì dưới đây?,
182,4,Người nhận hàng có các nghĩa vụ gì dưới đây?,
183,4,"Hàng siêu trường, siêu trọng được hiểu như thế nào là đúng?",
184,4,Việc vận chuyển động vật sống phải tuân theo những quy định nào dưới đây?,
185,4,Xe vận chuyển hàng nguy hiểm phải chấp hành những quy định nào dưới đây?,
186,4,"Trong đô thị, người lái xe buýt, xe chở hàng phải thực hiện những quy định nào dưới đây?",
187,4,Việc vận chuyển hàng hóa bằng xe ô tô phải chấp hành các quy định nào dưới đây?,
188,4,"Những ký hiệu hàng hóa dưới đây, ký hiệu nào chống mưa?",http://127.0.0.1:8080/C%C3%A2u%20188.jpg
189,4,Ký hiệu chuyên dùng nào biểu hiện hàng chuyên chở phải tránh ánh nắng mặt trời?,http://127.0.0.1:8080/C%C3%A2u%20189.jpg
190,4,Hình nào dưới đây biểu hiện hàng chuyên chở dễ vỡ phải cẩn thận?,http://127.0.0.1:8080/C%C3%A2u%20190.jpg
191,4,Hình nào dưới đây đòi hỏi hàng phải xếp theo hướng thẳng đứng?,http://127.0.0.1:8080/C%C3%A2u%20191.jpg
192,4,Hình nào dưới đây biểu hiện hàng chuyên chở là chất lỏng?,http://127.0.0.1:8080/C%C3%A2u%20192.jpg
193,5,"Người hành nghề lái xe khi thực hiện tốt việc rèn luyện, nâng cao trách nhiệm, đạo đức nghề nghiệp sẽ thu được kết quả như thế nào dưới đây?",
194,5,Người lái xe vận tải hàng hóa cần thực hiện những nhiệm vụ gì ghi ở dưới đây?,
195,5,Người lái xe kinh doanh vận tải cần thực hiện những công việc gì ghi ở dưới đây đê thường xuyên rèn luyện nâng cao đạo đức nghề nghiệp?,
196,5,Người lái xe và nhân viên phục vụ trên xe ô tô vận tải hành khách phải có những trách nhiệm gì theo quy định dưới đây?,
197,5,Khái niệm về văn hóa giao thông được hiểu như thế nào là đúng?,
198,5,"Trên làn đường dành cho ô tô có vũng nước lớn, có nhiều người đi xe mô tô trên làn đường bên cạnh, người lái xe ô tô xử lý như thế nào là có văn hóa giao thông?",
199,0," Người lái xe cố tình không phân biệt làn đường, vạch phân làn, phóng nhanh, vượt ẩu, vượt đèn đỏ, đi vào đường cấm, đường một chiều được coi là hành vi nào trong các hành vi dưới đây?",
200,5,"Khi sơ cứu người bị tai nạn giao thông đường bộ, có vết thương chảy máu ngoài, màu đỏ tươi phun thành tia và phun mạnh khi mạch đập, bạn phải làm gì dưới đây?",
201,5,Người lái xe có văn hóa khi tham gia giao thông phải đáp ứng các điều kiện nào dưới đây?,
202,5,"Trong các hành vi dưới đây, người lái xe mô tô có văn hóa giao thông phải ứng xử như thế nào?",
203,5,"Trong các hành vi dưới đây, người lái xe mô tô có văn hóa giao thông phải ứng xử như thế nào?",
204,5,"Trong các hành vi dưới đây, người lái xe ô tô, mô tô có văn hóa giao thông phải ứng xử như thế nào?",
205,5,Người có văn hóa giao thông khi điều khiển xe cơ giới tham gia giao thông đường bộ phải đảm bảo các điều kiện gì dưới đây?,
206,5,"Khi xảy ra tai nạn giao thông, người lái xe và người có mặt tại hiện trường vụ tai nạn phải thực hiện các công việc gì dưới đây?",
207,5,"Khi xảy ra tai nạn giao thông, có người bị thương nghiêm trọng, người lái xe và người có mặt tại hiện trường vụ tai nạn phải thực hiện các công việc gì dưới đây?",
208,5,"Khi sơ cứu ban đầu cho người bị tai nạn giao thông đường bộ không còn hô hấp, người lái xe và người có mặt tại hiện trường vụ tai nạn phải thực hiện các công việc gì dưới đây?",
209,0, Hành vi bỏ trốn sau khi gây tai nạn để trốn tránh trách nhiệm hoặc khi có điều kiện mà cố ý không cứu giúp người bị tai nạn giao thông có bị nghiêm cấm hay không?,
210,0," Khi xảy ra tai nạn giao thông, những hành vi nào dưới đây bị nghiêm cấm?",
211,0," Khi xảy ra tai nạn giao thông, những hành vi nào dưới đây bị nghiêm cấm?",
212,5,"Trong đoạn đường hai chiều tại khu đông dân cư đang ùn tắc, người điều khiển xe mô tô hai bánh có văn hóa giao thông sẽ lựa chọn xử lý tình huống nào dưới đây?",
213,5,Trên đường đang xảy ra ùn tắc những hành vi nào sau đây là thiếu văn hóa khi tham gia giao thông?,
214,0," Khi điều khiển xe mô tô tay ga xuống đường dốc dài, độ dốc cao, người lái xe cần thực hiện các thao tác nào dưới đây để đảm bảo an toàn?",
215,6,"Khi vào số để khởi hành xe ô tô có số tự động, người lái xe phải thực hiện các thao tác nào để đảm bảo an toàn?",
216,6,"Khi nhả hệ thống phanh dừng cơ khí điều khiển bằng tay (phanh tay), người lái xe cần phải thực hiện các thao tác nào?",
217,6,"Khi khởi hành ô tô sử dụng hộp số cơ khí trên đường bằng, người lái xe cần thực hiện các thao tác nào theo trình tự dưới đây?",
218,6,"Khi quay đầu xe, người lái xe cần phải quan sát và thực hiện các thao tác nào để đảm bảo an toàn giao thông?",
219,6,"Khi tránh nhau trên đường hẹp, người lái xe cần phải chú ý những điểm nào để đảm bảo an toàn giao thông?",
220,6,"Khi điều khiển ô tô lên dốc cao, người lái xe cần thực hiện các thao tác nào?",
221,0," Khi điều khiển ô tô xuống dốc cao, người lái xe cần thực hiện các thao tác nào dưới đây để đảm bảo an toàn?",
222,6,"Khi xuống dốc, muốn dừng xe, người lái xe cần thực hiện các thao tác nào để đảm bảo an toàn?",
223,6,Khi điều khiển xe trên đường vòng người lái xe cân phải làm gì để đảm bảo an toàn?,
224,6,"Khi điều khiển xe ô tô rẽ phải ở chỗ đường giao nhau, người lái xe cần thực hiện các thao tác nào để đảm bảo an toàn?",
225,6,"Khi điều khiển xe Ô tô rẽ trái ở chỗ đường giao nhau, người lái xe cần thực hiện các thao tác nào để đảm bảo an toàn?",
226,6,"Khi điều khiển xe sử dụng hộp số cơ khí vượt qua rãnh lớn cắt ngang mặt đường, người lái xe cần thực hiện các thao tác nào để đảm bảo an toàn?",
227,0," Khi điều khiển xe qua đường sắt, người lái xe cần phải thực hiện các thao tác nào dưới đây để đảm bảo an toàn?",
228,6,"Khi điều khiển xe ô tô tự đỏ, người lái xe cần chú ý những điểm gì để đảm bảo an toàn?",
229,6,"Khi điều khiển xe tăng số, người lái xe cần chú ý những điểm gì để đảm bảo an toàn?",
230,6,"Khi điều khiển xe giảm số, người lái xe cần chú ý những điểm gì để đảm bảo an toàn?",
231,0," Để giảm tốc độ khi ô tô đi xuống đường dốc dài, người lái xe phải thực hiện các thao tác nào để đảm bảo an toàn?",
232,6,"Khi điều khiển ô tô qua đoạn đường ngập nước, người lái xe cần thực hiện các thao tác nào để đảm bảo an toàn?",
233,6,"Khi điều khiển ô tô tới gần xe chạy ngược chiều vào ban đêm, người lái xe cần thực hiện các thao tác nào để đảm bảo an toàn?",
234,6,Khi điều khiển xe ô tô trên đường trơn cần chú ý những điểm gì để đảm bảo an toàn?,
235,6,"Khi động cơ ô tô đã khởi động, bảng đồng hồ xuất hiện ký hiệu như hình vẽ dưới đây, báo hiệu tình trạng như thế nào của xe ô tô?",http://127.0.0.1:8080/C%C3%A2u%20235.jpg
236,6,"Khi động cơ ô tô đã khởi động, bảng đồng hồ xuất hiện ký hiệu như hình vẽ dưới đây, báo hiệu tình trạng như thế nào của xe ô tô?",http://127.0.0.1:8080/C%C3%A2u%20236.jpg
237,6,"Khi động cơ ô tô đã khởi động, bảng đồng hồ xuất hiện ký hiệu như hình vẽ dưới đây, báo hiệu tình trạng như thế nào của xe ô tô?",http://127.0.0.1:8080/C%C3%A2u%20237.jpg
238,6,"Khi động cơ ô tô đã khởi động, bảng đồng hồ xuất hiện ký hiệu như hình vẽ dưới đây, báo hiệu tình trạng như thế nào của xe ô tô?",http://127.0.0.1:8080/C%C3%A2u%20238.jpg
239,6,"Khi động cơ ô tô đã khởi động, bảng đồng hồ xuất hiện ký hiệu như hình vẽ dưới đây, báo hiệu tình trạng như thế nào của xe ô tô?",http://127.0.0.1:8080/C%C3%A2u%20239.jpg
240,6,"Trong các loại nhiên liệu dưới đây, loại nhiên liệu nào giảm thiểu ô nhiễm môi trường?",
241,6,Các biển pháp tiết kiệm nhiên liệu khi chạy xe?,
242,0," Khi đã đỗ xe ô tô sát lề đường bên phải, người lái xe phải thực hiện các thao tác nào dưới đây khi mở cửa xuống xe để đảm bảo an toàn?",
243,6,"Khi lái xe ô tô qua đường sắt không có rào chắn, không có người điều khiển giao thông, người lái xe phải xử lý như thế nào để đảm bảo an toàn?",
244,6,"Khi lái xe ô tô qua đường sắt không có rào chắn, không có người điều khiển giao thông, người lái xe thực hiện thao tác: tạm dừng, xe tại vị trí cách đường sắt tối thiểu 5 mét, hạ kính cửa, tắt các thiết bị âm thanh trên xe, quan sát và nêu không có tàu chạy qua thì về số thấp, tăng ga nhẹ để tránh động cơ chết máy cho xe vượt qua để đảm bảo an toàn là đúng hay không?",
245,0," Khi điều khiển ô tô có hộp số tự động đi vào đường trơn trượt, lầy lội, người lái xe phải xử lí như thế nào để đảm bảo an toàn trong các trường hợp dưới đây?",
246,6,"Khi động cơ ô tô đã khởi động, muốn điều chỉnh ghế của người lái, người lái xe phải đề cần số ở vị trí nào?",
247,6,"Khi điều khiển ô tô có hộp số tự động, người lái xe sử dụng chân như thế nào là đúng để bảo đảm an toàn?",
248,0," Khi tầm nhìn bị hạn chế bởi sương mù hoặc mưa to, người lái xe phải thực hiện các thao tác nào?",
249,6,"Khi đèn pha của xe đi ngược chiều gây chói mắt, làm giảm khả năng quan sát trên đường, người lái xe xử lý như thế nào để đảm bảo an toàn?",
250,6,"Để đạt được hiệu quả phanh cao nhất, người lái xe mô tô phải sử dụng các kỹ năng như thế nào dưới đây?",
251,6,"Khi lái xe ô tô trên mặt đường có nhiều “ổ gà”, người lái xe phải thực hiện thao tác như thế nào để đảm bảo an toàn?",
252,6,"Khi điều khiển ô tô gặp mưa to hoặc sương mù, người lái xe phải làm gì để đảm bảo an toàn?",
253,6,"Điều khiển xe ô tô trong trời mưa, người lái xe phải xử lý như thế nào để đảm bảo an toàn?",
254,6,"Khi lùi xe, người lái xe phải xử lý như thế nào để bảo đảm an toàn giao thông?",
255,6,Điều khiển xe ô tô trong khu vực đông dân cư cần lưu ý điều gì dưới đây?,
256,6,Khi điều khiển xe ô tô nhập vào đường cao tốc người lái xe cần thực hiện như thế nào dưới đây để bảo đảm an toàn giao thông?,
257,6,Khi điều khiển xe ô tô ra khỏi đường cao tốc người lái xe cần thực hiện như thế nào dưới đây để bảo đảm an toàn giao thông?,
258,0," Người lái xe được dừng xe, đỗ xe trên làn dừng khẩn cấp của đường cao tốc trong trường hợp nào dưới đây?",
259,6,"Trong trường hợp bất khả kháng, khi dừng xe, đỗ xe trên làn dừng khẩn cấp của đường cao tốc người lái xe phải xử lý như thế nào dưới đây là đúng quy tắc giao thông?",
260,0," Khi điều khiển ô tô xuống đường dốc dài, độ dốc cao, người lái xe số tự động cần thực hiện các thao tác nào dưới đây để đảm bảo an toàn?",
261,0," Khi đi từ đường nhánh ra đường chính, người lái xe phải xử lý như nào là đúng quy tắc giao thông?",
262,0," Khi đang lái xe mô tô và ô tô, nếu có nhu cầu sử dụng điện thoại để nhắn tin hoặc gọi điện, người lái xe phải thực hiện như thế nào trong các tình huống nêu dưới đây?",
263,6,Những thói quen nào dưới đây khi điều khiển xe mô tô tay ga tham gia giao thông dễ gây tai nạn nguy hiểm?,
264,6,Người ngồi trên xe ô tô cần thực hiện những thao tác mở cửa như thế nào dưới đây để xuống xe một cách an toàn?,
265,6,Khi điều khiển xe mô tô quay đầu người lái xe cần thực hiện như thế nào để đảm bảo an toàn?,
266,6,Tay ga trên xe mô tô hai bánh có tác dụng gì trong các trường hợp dưới đây?,
267,6,"Gương chiếu hậu của xe mô tô hai bánh, có tác dụng gì trong các trường hợp dưới đây?",
268,6,"Để đảm bảo an toàn khi tham gia giao thông, người lái xe lái xe mô tô hai bánh cần điều khiển tay ga như thế nào trong các trường hợp dưới đây?",
269,6,Kỹ thuật cơ bản để giữ thăng bằng khi điều khiển xe mô tô đi trên đường gồ ghề như thế nào trong các trường hợp dưới đây?,
270,7,"Chủ phương tiện cơ giới đường bộ có được tự ý thay đổi màu sơn, nhãn hiệu hoặc các đặc tính kỹ thuật của phương tiện so với chứng nhận đăng ký xe hay không?",
271,7,"Xe ô tô tham gia giao thông đường bộ phải bảo đảm các quy định về chất lượng, an toàn kỹ thuật và bảo vệ môi trường nào ghi dưới đây?",
272,7,Xe mô tô và xe ô tô tham gia giao thông trên đường bộ phải bắt buộc có đủ bộ phận giảm thanh không?,
273,7,Xe ô tô tham gia giao thông trên đường bộ phải có đủ các loại đèn gì dưới đây?,
274,7,Kính chắn gió của xe ô tô phải đảm bảo yêu cầu nào dưới đây?,
275,7,Bánh xe lắp cho xe ô tô phải đảm bảo an toàn kỹ thuật như thê nào dưới đây?,
276,7,"Âm lượng của còi điện lắp trên ô tô (đo ở độ cao 1,2 mét với khoảng cách 2 mét tính từ đầu xe) là bao nhiêu?",
277,7,Mục đích của bảo dưỡng thường xuyên đối với xe ô tô có tác dụng gì dưới đây?,
278,7,"Trong các nguyên nhân nêu dưới đây, nguyên nhân nào làm động cơ diesel không nổ?",
279,7,Gạt nước lắp trên ô tô phải đảm bảo yêu cầu an toàn kỹ thuật nào dưới đây?,
280,7,Dây đai an toàn lắp trên ô tô phải đảm bảo yêu cầu an toàn kỹ thuật dưới đây?,
281,7,Thế nào là động cơ 4 kỳ?,
282,7,Công dụng của hệ thống bôi trơn đối với động cơ ô tô?,
283,7,Niên hạn sử dụng của xe ô tô tải (tính bắt đầu từ năm sản xuất) là bao nhiêu năm?,
284,7,Niên hạn sử dụng của xe ô tô chở người trên 9 chỗ ngồi (tính bắt đầu từ năm sản xuất) là bao nhiêu năm?,
285,7,Hãy nêu công dụng của động cơ xe ô tô?,
286,7,Hãy nêu công dụng hệ thống truyền lực của xe ô tô?,
287,7,Hãy nêu công dụng ly hợp (côn) của xe ô tô?,
288,7,Hãy nêu công dụng hộp số của xe ô tô?,
289,7,Hãy nêu công dụng hệ thống lái của xe ô tô?,
290,7,Hãy nêu công dụng hệ thống phanh của xe ô tô?,
291,7,Đèn phanh trên xe mô tô có tác dụng gì dưới đây?,
292,7,"Khi động cơ ô tô đã khởi động, bảng đồng hồ xuất hiện ký hiệu như hình vẽ dưới đây, báo hiệu tình trạng như thế nào của xe ô tô?",http://127.0.0.1:8080/C%C3%A2u%20292.jpg
293,7,"Khi động cơ ô tô đã khởi động, bảng đồng hồ xuất hiện ký hiệu như hình vẽ dưới đây, báo hiệu tình trạng như thế nào của xe ô tô?",http://127.0.0.1:8080/C%C3%A2u%20293.jpg
294,7,"Khi động cơ ô tô đã khởi động, bảng đồng hồ xuất hiện ký hiệu như hình vẽ dưới đây, báo hiệu tình trạng như thế nào của xe ô tô?",http://127.0.0.1:8080/C%C3%A2u%20294.jpg
295,7,"Khi động cơ ô tô đã khởi động, bảng đồng hồ xuất hiện ký hiệu như hình vẽ dưới đây, báo hiệu tình trạng như thế nào của xe ô tô?",http://127.0.0.1:8080/C%C3%A2u%20295.jpg
296,7,Khi khởi động xe ô tô số tự động có trang bị chìa khóa thông minh có cần đạp hết hành trình bàn đạp chân phanh hay không?,http://127.0.0.1:8080/C%C3%A2u%20296.jpg
297,7,Ắc quy được trang bị trên xe ô tô có tác dụng gì dưới đây?,
298,7,Máy phát điện được trang bị trên xe ô tô có tác dụng gì dưới đây?,
299,7,Dây đai an toàn được trang bị trên xe ô tô có tác dụng gì dưới đây?,
300,7,Túi khí được trang bị trên xe ô tô có tác dụng gì dưới đây?,
301,7,"Khi động cơ ô tô đã khởi động, bảng đồng hồ xuất hiện ký hiệu như hình vẽ dưới đây không tắt trong thời gian dài, báo hiệu tình trạng như thế nào của xe ô tô?",http://127.0.0.1:8080/C%C3%A2u%20301.jpg
302,7,Trên xe ô tô có trang bị thiết bị như hình vẽ có tác dụng gì dưới đây?,http://127.0.0.1:8080/C%C3%A2u%20302.jpg
303,7,"Trên xe ô tô có trang bị thiết bị như hình vẽ, dùng để làm gì?",http://127.0.0.1:8080/C%C3%A2u%20303.jpg
304,7,"Trên xe ô tô có trang bị thiết bị như hình vẽ, dùng để làm gì?",http://127.0.0.1:8080/C%C3%A2u%20304.jpg
305,8,"Biển nào cấm các loại xe cơ giới đi vào, trừ xe gắn máy, mô tô hai bánh và các loại xe ưu tiên theo luật định?",http://127.0.0.1:8080/C%C3%A2u%20305.jpg
306,8,Biển nào cấm ô tô tải?,http://127.0.0.1:8080/C%C3%A2u%20306.jpg
307,8,Biển nào cấm máy kéo?,http://127.0.0.1:8080/C%C3%A2u%20307.jpg
308,8,Biển nào báo hiệu cấm xe mô tô ba bánh đi vào?,http://127.0.0.1:8080/C%C3%A2u%20308.jpg
309,8,Biển nào dưới đây xe gắn máy được phép đi vào?,http://127.0.0.1:8080/C%C3%A2u%20309.jpg
310,8,Biển nào báo hiệu cấm xe mô tô hai bánh đi vào?,http://127.0.0.1:8080/C%C3%A2u%20310.jpg
311,8,Khi gặp biển nào thì xe mô tô hai bánh được đi vào?,http://127.0.0.1:8080/C%C3%A2u%20311.jpg
312,8,Biển nào cho phép ô tô con được vượt?,http://127.0.0.1:8080/C%C3%A2u%20312.jpg
313,8,Biển nào không cho phép ô tô con vượt?,http://127.0.0.1:8080/C%C3%A2u%20313.jpg
314,8,Biển nào cấm ô tô tải vượt?,http://127.0.0.1:8080/C%C3%A2u%20314.jpg
315,8,Biển nào cấm xe tải vượt?,http://127.0.0.1:8080/C%C3%A2u%20315.jpg
316,8,Biển nào xe ô tô con được phép vượt?,http://127.0.0.1:8080/C%C3%A2u%20316.jpg
317,8,Biển nào cấm quay đầu xe?,http://127.0.0.1:8080/C%C3%A2u%20317.jpg
318,8,Biển nào cấm xe rẽ trái?,http://127.0.0.1:8080/C%C3%A2u%20318.jpg
319,8,Khi gặp biển nào xe được rẽ trái?,http://127.0.0.1:8080/C%C3%A2u%20319.jpg
320,8,Biển nào cấm ô tô rẽ trái?,http://127.0.0.1:8080/C%C3%A2u%20320.jpg
321,8,Biển nào cấm các phương tiện giao thông đường bộ rẽ,http://127.0.0.1:8080/C%C3%A2u%20321.jpg
322,8,Biển nào cấm các phương tiện giao thông đường bộ rẽ trái?,http://127.0.0.1:8080/C%C3%A2u%20322.jpg
323,8,Biển nào dưới đây cắm ô tô quay đầu?,http://127.0.0.1:8080/C%C3%A2u%20323.jpg
324,8,Biển nào dưới đây cắm ô tô quay đầu và rẽ phải?,http://127.0.0.1:8080/C%C3%A2u%20324.jpg
325,8,Biển nào cấm xe taxi mà không câm các phương tiện khác?,http://127.0.0.1:8080/C%C3%A2u%20325.jpg
326,8,Biển nào cho phép xe rẽ trái?,http://127.0.0.1:8080/C%C3%A2u%20326.jpg
327,8,Biển nào xe quay đầu không bị cắm?,http://127.0.0.1:8080/C%C3%A2u%20327.jpg
328,8,Biển nào xe được phép quay đầu nhưng không được rẽ trái?,http://127.0.0.1:8080/C%C3%A2u%20328.jpg
329,8,Biển nào là biển “Cấm đi ngược chiều”?,http://127.0.0.1:8080/C%C3%A2u%20329.jpg
